{
  "profile_name": "loop-builtin-defaults",
  "source_image": "builtin",
  "detected_at": "1970-01-01T00:00:00Z",
  "cookie": {
    "x": 1600.8,
    "y": -410.9,
    "confidence": 1.0
  },
  "store": {
    "x": 2344.4,
    "panel_top": -720.0,
    "panel_bottom": 120.0,
    "row_spacing": 63.5,
    "confidence": 1.0
  },
  "ladder_rows": [
    {"name": "time_machine", "x": 2344.4, "y": 14.5888, "confidence": 1.0},
    {"name": "portal", "x": 2344.4, "y": -48.8354, "confidence": 1.0},
    {"name": "alchemy_lab", "x": 2344.4, "y": -103.6, "confidence": 1.0},
    {"name": "shipment", "x": 2344.4, "y": -177.5, "confidence": 1.0},
    {"name": "wizard_tower", "x": 2344.4, "y": -237.3, "confidence": 1.0},
    {"name": "temple", "x": 2344.4, "y": -304.6, "confidence": 1.0},
    {"name": "bank", "x": 2344.4, "y": -368.1, "confidence": 1.0},
    {"name": "factory", "x": 2344.4, "y": -430.9, "confidence": 1.0},
    {"name": "mine", "x": 2344.4, "y": -495.6, "confidence": 1.0},
    {"name": "farm", "x": 2344.4, "y": -558.5, "confidence": 1.0},
    {"name": "grandma", "x": 2344.4, "y": -623.4, "confidence": 1.0},
    {"name": "cursor", "x": 2344.4, "y": -689.3, "confidence": 1.0}
  ],
  "preview_defaults": {
    "cookie_click_count": 3000,
    "ladder_click_count": 5,
    "cycle_sleep_seconds": 30
  },
  "warnings": [
    "Built-in defaults used when macos_mouse_click_loop.sh runs without -P. Edit osx/config/cookie_clicker_profile.defaults.json or pass -P <profile.json>."
  ]
}
